{
  "accepted_geometry": {
    "bounds": {
      "x0": -4460,
      "x1": 4456,
      "y0": -8,
      "y1": 1859.1399999999999
    },
    "branches": [
      {
        "child": "category:2944",
        "d": "M-4334,377.72L-4334,453.72",
        "parent": "category:126",
        "points": [
          {
            "x": -4334,
            "y": 377.72
          },
          {
            "x": -4334,
            "y": 453.72
          }
        ]
      },
      {
        "child": "category:126",
        "d": "M-3144,230.6L-3144,258.6L-4334,258.6L-4334,312.6",
        "parent": "category:1163",
        "points": [
          {
            "x": -3144,
            "y": 230.6
          },
          {
            "x": -3144,
            "y": 258.6
          },
          {
            "x": -4334,
            "y": 258.6
          },
          {
            "x": -4334,
            "y": 312.6
          }
        ]
      },
      {
        "child": "category:386",
        "d": "M-3994,518.84L-3994,786.84",
        "parent": "category:262",
        "points": [
          {
            "x": -3994,
            "y": 518.84
          },
          {
            "x": -3994,
            "y": 786.84
          }
        ]
      },
      {
        "child": "category:262",
        "d": "M-3654,377.72L-3654,405.72L-3994,405.72L-3994,453.72",
        "parent": "category:258",
        "points": [
          {
            "x": -3654,
            "y": 377.72
          },
          {
            "x": -3654,
            "y": 405.72
          },
          {
            "x": -3994,
            "y": 405.72
          },
          {
            "x": -3994,
            "y": 453.72
          }
        ]
      },
      {
        "child": "category:4503",
        "d": "M-3314,518.84L-3314,786.84",
        "parent": "category:4502",
        "points": [
          {
            "x": -3314,
            "y": 518.84
          },
          {
            "x": -3314,
            "y": 786.84
          }
        ]
      },
      {
        "child": "category:4502",
        "d": "M-3654,377.72L-3654,405.72L-3314,405.72L-3314,453.72",
        "parent": "category:258",
        "points": [
          {
            "x": -3654,
            "y": 377.72
          },
          {
            "x": -3654,
            "y": 405.72
          },
          {
            "x": -3314,
            "y": 405.72
          },
          {
            "x": -3314,
            "y": 453.72
          }
        ]
      },
      {
        "child": "category:258",
        "d": "M-3144,230.6L-3144,258.6L-3654,258.6L-3654,312.6",
        "parent": "category:1163",
        "points": [
          {
            "x": -3144,
            "y": 230.6
          },
          {
            "x": -3144,
            "y": 258.6
          },
          {
            "x": -3654,
            "y": 258.6
          },
          {
            "x": -3654,
            "y": 312.6
          }
        ]
      },
      {
        "child": "category:1432",
        "d": "M-2974,518.84L-2974,786.84",
        "parent": "category:850",
        "points": [
          {
            "x": -2974,
            "y": 518.84
          },
          {
            "x": -2974,
            "y": 786.84
          }
        ]
      },
      {
        "child": "category:850",
        "d": "M-2464,377.72L-2464,405.72L-2974,405.72L-2974,453.72",
        "parent": "category:357",
        "points": [
          {
            "x": -2464,
            "y": 377.72
          },
          {
            "x": -2464,
            "y": 405.72
          },
          {
            "x": -2974,
            "y": 405.72
          },
          {
            "x": -2974,
            "y": 453.72
          }
        ]
      },
      {
        "child": "category:516",
        "d": "M-2294,518.84L-2294,786.84",
        "parent": "category:1186",
        "points": [
          {
            "x": -2294,
            "y": 518.84
          },
          {
            "x": -2294,
            "y": 786.84
          }
        ]
      },
      {
        "child": "category:1186",
        "d": "M-2464,377.72L-2464,405.72L-2294,405.72L-2294,453.72",
        "parent": "category:357",
        "points": [
          {
            "x": -2464,
            "y": 377.72
          },
          {
            "x": -2464,
            "y": 405.72
          },
          {
            "x": -2294,
            "y": 405.72
          },
          {
            "x": -2294,
            "y": 453.72
          }
        ]
      },
      {
        "child": "category:679",
        "d": "M-1954,518.84L-1954,786.84",
        "parent": "category:1188",
        "points": [
          {
            "x": -1954,
            "y": 518.84
          },
          {
            "x": -1954,
            "y": 786.84
          }
        ]
      },
      {
        "child": "category:1188",
        "d": "M-2464,377.72L-2464,405.72L-1954,405.72L-1954,453.72",
        "parent": "category:357",
        "points": [
          {
            "x": -2464,
            "y": 377.72
          },
          {
            "x": -2464,
            "y": 405.72
          },
          {
            "x": -1954,
            "y": 405.72
          },
          {
            "x": -1954,
            "y": 453.72
          }
        ]
      },
      {
        "child": "category:357",
        "d": "M-3144,230.6L-3144,258.6L-2464,258.6L-2464,312.6",
        "parent": "category:1163",
        "points": [
          {
            "x": -3144,
            "y": 230.6
          },
          {
            "x": -3144,
            "y": 258.6
          },
          {
            "x": -2464,
            "y": 258.6
          },
          {
            "x": -2464,
            "y": 312.6
          }
        ]
      },
      {
        "child": "category:1163",
        "d": "M0,63.04L0,91.03999999999999L-3144,91.03999999999999L-3144,151.04",
        "parent": "category:1162",
        "points": [
          {
            "x": 0,
            "y": 63.04
          },
          {
            "x": 0,
            "y": 91.03999999999999
          },
          {
            "x": -3144,
            "y": 91.03999999999999
          },
          {
            "x": -3144,
            "y": 151.04
          }
        ]
      },
      {
        "child": "category:3",
        "d": "M-716,518.84L-716,546.84L-1566,546.84L-1566,786.84",
        "parent": "category:252",
        "points": [
          {
            "x": -716,
            "y": 518.84
          },
          {
            "x": -716,
            "y": 546.84
          },
          {
            "x": -1566,
            "y": 546.84
          },
          {
            "x": -1566,
            "y": 786.84
          }
        ]
      },
      {
        "child": "category:35",
        "d": "M-716,518.84L-716,546.84L-1226,546.84L-1226,786.84",
        "parent": "category:252",
        "points": [
          {
            "x": -716,
            "y": 518.84
          },
          {
            "x": -716,
            "y": 546.84
          },
          {
            "x": -1226,
            "y": 546.84
          },
          {
            "x": -1226,
            "y": 786.84
          }
        ]
      },
      {
        "child": "category:74",
        "d": "M-716,518.84L-716,546.84L-886,546.84L-886,786.84",
        "parent": "category:252",
        "points": [
          {
            "x": -716,
            "y": 518.84
          },
          {
            "x": -716,
            "y": 546.84
          },
          {
            "x": -886,
            "y": 546.84
          },
          {
            "x": -886,
            "y": 786.84
          }
        ]
      },
      {
        "child": "category:153",
        "d": "M-716,518.84L-716,546.84L-546,546.84L-546,786.84",
        "parent": "category:252",
        "points": [
          {
            "x": -716,
            "y": 518.84
          },
          {
            "x": -716,
            "y": 546.84
          },
          {
            "x": -546,
            "y": 546.84
          },
          {
            "x": -546,
            "y": 786.84
          }
        ]
      },
      {
        "child": "category:188",
        "d": "M-716,518.84L-716,546.84L-206,546.84L-206,786.84",
        "parent": "category:252",
        "points": [
          {
            "x": -716,
            "y": 518.84
          },
          {
            "x": -716,
            "y": 546.84
          },
          {
            "x": -206,
            "y": 546.84
          },
          {
            "x": -206,
            "y": 786.84
          }
        ]
      },
      {
        "child": "category:306",
        "d": "M-716,518.84L-716,546.84L134,546.84L134,786.84",
        "parent": "category:252",
        "points": [
          {
            "x": -716,
            "y": 518.84
          },
          {
            "x": -716,
            "y": 546.84
          },
          {
            "x": 134,
            "y": 546.84
          },
          {
            "x": 134,
            "y": 786.84
          }
        ]
      },
      {
        "child": "category:252",
        "d": "M1154,377.72L1154,405.72L-716,405.72L-716,453.72",
        "parent": "category:73",
        "points": [
          {
            "x": 1154,
            "y": 377.72
          },
          {
            "x": 1154,
            "y": 405.72
          },
          {
            "x": -716,
            "y": 405.72
          },
          {
            "x": -716,
            "y": 453.72
          }
        ]
      },
      {
        "child": "category:95",
        "d": "M1664,518.84L1664,546.84L474,546.84L474,786.84",
        "parent": "category:1258",
        "points": [
          {
            "x": 1664,
            "y": 518.84
          },
          {
            "x": 1664,
            "y": 546.84
          },
          {
            "x": 474,
            "y": 546.84
          },
          {
            "x": 474,
            "y": 786.84
          }
        ]
      },
      {